{
  "schema_version": "1.0",
  "generated_by": {
    "name": "matryoshka",
    "version": "0.1.0a1"
  },
  "reference_database": {
    "version": "2026.08.27-alpha.2",
    "profile": "validated"
  },
  "run": {
    "input": "demo-output/arbitrary-tn123/arbitrary-demo.fasta",
    "input_sha256": "4aba0208d1c4b746e62e9fd6c997238518ca406607c54f1e5b8afdb7edf61e9f",
    "command": "matryoshka run demo-output/arbitrary-tn123/arbitrary-demo.fasta --profile validated --threads 4 --out demo-output/arbitrary-tn123/proof-bundle",
    "python": "3.13.15",
    "platform": "macOS-14.6.1-arm64-arm-64bit-Mach-O",
    "detector_outputs": {}
  },
  "records": [
    {
      "id": "arbitrary_demo_contig",
      "length": 44647,
      "features": [
        {
          "id": "mge-arbitrary_demo_contig-transposon-999f2989b1",
          "parent_id": null,
          "element_type": "transposon",
          "family": "Tn1",
          "name": "Tn1-like",
          "start": 8001,
          "end": 12949,
          "strand": "+",
          "tsd_length": 5,
          "tsd_seq": null,
          "ir_left": "GGGGTCTGACGCTCAGTGGAACGAAAACTCACGTTAAG",
          "ir_right": "CTTAACGTGAGTTTTCGTTCCACTGAGCGTCAGACCCC",
          "score": 99.495,
          "attributes": {
            "seqid": "arbitrary_demo_contig",
            "reference_id": "Tn1_NC_008357",
            "source": "reference_scan",
            "source_accession": "NC_008357",
            "definition_id": "Tn1_NC_008357",
            "definition_version": "2026-08-27",
            "defined_type": "Tn1",
            "defined_subtype": "canonical",
            "closest_definition": "Tn1",
            "reference_kind": "canonical",
            "expert_rule": "Exact, complete, gap-free match to NC_008357 plus complete component grammar.",
            "known_differences_from_parent": [],
            "review_status": "Sally-selected canonical sequence",
            "tn123_canonical": "true",
            "best_match": "Tn1",
            "blast_identity": 99.5,
            "blast_coverage": 100.0,
            "blast_subject_coverage": 100.0,
            "blast_hsp_count": 1,
            "reference_length": 4949,
            "reference_segments": [
              {
                "qstart": 8001,
                "qend": 12949,
                "sstart": 1,
                "send": 4949,
                "identity": 99.495,
                "mismatch_bases": 25,
                "gap_bases": 0
              }
            ],
            "variant_margin": 1.64,
            "variant_status": "minor_sequence_variant",
            "structural_status": "intact",
            "query_span": 4949,
            "inserted_bases": 0,
            "deleted_bases": 0,
            "mismatch_bases": 25,
            "alignment_gap_bases": 0,
            "left_end_covered": true,
            "right_end_covered": true,
            "note": "closest definition is Tn1 (Tn1); reported as a variant",
            "component_assembly_status": "complete",
            "component_order_valid": true,
            "component_requirements": {
              "terminal_IR": true,
              "blaTEM": true,
              "tnpR": true,
              "res": true,
              "tnpA": true
            },
            "detected_component_count": 6,
            "component_evidence": [
              {
                "role": "terminal_IR",
                "name": "IRL",
                "start": 8001,
                "end": 8038,
                "strand": ".",
                "evidence_class": "sequence_detected",
                "identity": 100.0,
                "coverage": 100.0,
                "status": "intact",
                "component_status": "complete",
                "reference": "Tn2c_HM749967__IRR__4913_4950",
                "reference_segments": [
                  {
                    "qstart": 8001,
                    "qend": 8038,
                    "sstart": 38,
                    "send": 1,
                    "identity": 100.0,
                    "mismatch_bases": 0,
                    "gap_bases": 0
                  }
                ],
                "inserted_bases": 0
              },
              {
                "role": "blaTEM",
                "name": "blaTEM-2",
                "start": 8148,
                "end": 9008,
                "strand": "-",
                "evidence_class": "sequence_detected",
                "identity": 99.42,
                "coverage": 100.0,
                "status": "intact",
                "component_status": "complete",
                "reference": "Tn1_NC_008357__blaTEM_2__148_1008",
                "reference_segments": [
                  {
                    "qstart": 8148,
                    "qend": 9008,
                    "sstart": 1,
                    "send": 861,
                    "identity": 99.419,
                    "mismatch_bases": 5,
                    "gap_bases": 0
                  }
                ],
                "inserted_bases": 0
              },
              {
                "role": "tnpR",
                "name": "tnpR",
                "start": 9191,
                "end": 9748,
                "strand": "-",
                "evidence_class": "sequence_detected",
                "identity": 99.1,
                "coverage": 100.0,
                "status": "intact",
                "component_status": "complete",
                "reference": "Tn1_NC_008357__tnpR__1191_1748",
                "reference_segments": [
                  {
                    "qstart": 9191,
                    "qend": 9748,
                    "sstart": 1,
                    "send": 558,
                    "identity": 99.104,
                    "mismatch_bases": 5,
                    "gap_bases": 0
                  }
                ],
                "inserted_bases": 0
              },
              {
                "role": "res",
                "name": "res",
                "start": 9754,
                "end": 9867,
                "strand": ".",
                "evidence_class": "sequence_detected",
                "identity": 100.0,
                "coverage": 100.0,
                "status": "intact",
                "component_status": "complete",
                "reference": "Tn1_NC_008357__res__1754_1867",
                "reference_segments": [
                  {
                    "qstart": 9754,
                    "qend": 9867,
                    "sstart": 1,
                    "send": 114,
                    "identity": 100.0,
                    "mismatch_bases": 0,
                    "gap_bases": 0
                  }
                ],
                "inserted_bases": 0
              },
              {
                "role": "tnpA",
                "name": "tnpA",
                "start": 9911,
                "end": 12916,
                "strand": "+",
                "evidence_class": "sequence_detected",
                "identity": 99.57,
                "coverage": 100.0,
                "status": "intact",
                "component_status": "complete",
                "reference": "Tn1_NC_008357__tnpA__1911_4916",
                "reference_segments": [
                  {
                    "qstart": 9911,
                    "qend": 12916,
                    "sstart": 1,
                    "send": 3006,
                    "identity": 99.568,
                    "mismatch_bases": 13,
                    "gap_bases": 0
                  }
                ],
                "inserted_bases": 0
              },
              {
                "role": "terminal_IR",
                "name": "IRR",
                "start": 12912,
                "end": 12949,
                "strand": ".",
                "evidence_class": "sequence_detected",
                "identity": 100.0,
                "coverage": 100.0,
                "status": "intact",
                "component_status": "complete",
                "reference": "Tn2c_HM749967__IRR__4913_4950",
                "reference_segments": [
                  {
                    "qstart": 12912,
                    "qend": 12949,
                    "sstart": 1,
                    "send": 38,
                    "identity": 100.0,
                    "mismatch_bases": 0,
                    "gap_bases": 0
                  }
                ],
                "inserted_bases": 0
              }
            ],
            "naming_evidence": [
              "component_grammar",
              "whole_locus_alignment"
            ],
            "evidence_class": "sequence_detected_and_assembled",
            "curated_internal_features": false,
            "ir_length": 38,
            "independently_detected_internal_features": true,
            "reference_projected_component_count": 0,
            "reference_projected_context_feature_count": 0,
            "ir_evidence": "sequence_matched",
            "tsd_evidence": "searched_not_found",
            "confidence": 1.0,
            "confidence_label": "high"
          },
          "children": [
            {
              "id": "mge-arbitrary_demo_contig-IR-a6b95d42f3",
              "parent_id": "mge-arbitrary_demo_contig-transposon-999f2989b1",
              "element_type": "IR",
              "family": "Tn3_family",
              "name": "IRL",
              "start": 8001,
              "end": 8038,
              "strand": ".",
              "tsd_length": null,
              "tsd_seq": null,
              "ir_left": null,
              "ir_right": null,
              "score": 100.0,
              "attributes": {
                "seqid": "arbitrary_demo_contig",
                "source": "tn123_component_scan",
                "evidence_class": "sequence_detected",
                "component_role": "terminal_IR",
                "component_reference": "Tn2c_HM749967__IRR__4913_4950",
                "reference_parent": "Tn2c_HM749967",
                "reference_family": "Tn2",